{
  "invitation_id": "31a104ac-a541-48dd-9547-7236bded34fb",
  "session_id": "21a104ac-a541-48dd-9547-7236bded34fb",
  "game_slug": "overrun-blitzkrieg",
  "game_title": "OVER•RUN: BLITZKRIEG",
  "inviter_public_id": "8MCR-LXFH",
  "inviter_username": "sen11k",
  "recipient_public_id": "FRND-0001",
  "recipient_username": "friend",
  "status": "pending",
  "expires_at": "2026-10-05T21:00:00Z",
  "created_at": "2026-10-05T20:45:00Z"
}
